<?xml version="1.0" encoding="UTF-8"?>
<!DOCTYPE colors SYSTEM "color.dtd">
<colors name="European/Asian for Colourblind" parentName="Default" firstStartBoxColor="#ff9a9a" secondStartBoxColor="#ffd2d2" twoPushDynamicInactiveMarkerColor="#ffc888" twoPushDynamicOuterGuidesColor="#fff082" conversionNodeColor="#f5f5f5">
	<groupColorInfo name="lowercase" nodeColorSequence="#00ffff,#b4eeb4,#9bcd9b,#00ffff,#b4eeb4,#9bcd9b,#00ffff,#b4eeb4,#9bcd9b,#00ffff,#b4eeb4,#9bcd9b,#00ffff,#b4eeb4,#9bcd9b,#00ffff,#b4eeb4,#9bcd9b,#00ffff,#b4eeb4,#9bcd9b,#00ffff,#b4eeb4,#9bcd9b,#00ffff,#b4eeb4,#9bcd9b,#00ffff,#b4eeb4,#9bcd9b" altNodeColorSequence="#87ceff,#ffaeb9,#ffc888,#87ceff,#ffaeb9,#ffc888,#87ceff,#ffaeb9,#ffc888,#87ceff,#ffaeb9,#ffc888,#87ceff,#ffaeb9,#ffc888,#87ceff,#ffaeb9,#ffc888,#87ceff,#ffaeb9,#ffc888,#87ceff,#ffaeb9,#ffc888,#87ceff,#ffaeb9,#ffc888,#87ceff,#ffaeb9,#ffc888" />
	<groupColorInfo name="lowercaseBackground" groupColor="#dcdcdc" groupOutlineColor="#dadada" nodeColorSequence="#00ffff,#b4eeb4,#9bcd9b,#00ffff,#b4eeb4,#9bcd9b,#00ffff,#b4eeb4,#9bcd9b,#00ffff,#b4eeb4,#9bcd9b,#00ffff,#b4eeb4,#9bcd9b,#00ffff,#b4eeb4,#9bcd9b,#00ffff,#b4eeb4,#9bcd9b,#00ffff,#b4eeb4,#9bcd9b,#00ffff,#b4eeb4,#9bcd9b,#00ffff,#b4eeb4,#9bcd9b" altNodeColorSequence="#87ceff,#ffaeb9,#ffc888,#87ceff,#ffaeb9,#ffc888,#87ceff,#ffaeb9,#ffc888,#87ceff,#ffaeb9,#ffc888,#87ceff,#ffaeb9,#ffc888,#87ceff,#ffaeb9,#ffc888,#87ceff,#ffaeb9,#ffc888,#87ceff,#ffaeb9,#ffc888,#87ceff,#ffaeb9,#ffc888,#87ceff,#ffaeb9,#ffc888" />
	<groupColorInfo name="uppercase" groupColor="#ffff00" groupOutlineColor="#dadada" nodeColorSequence="#00ffff,#b4eeb4,#9bcd9b,#00ffff,#b4eeb4,#9bcd9b,#00ffff,#b4eeb4,#9bcd9b,#00ffff,#b4eeb4,#9bcd9b,#00ffff,#b4eeb4,#9bcd9b,#00ffff,#b4eeb4,#9bcd9b,#00ffff,#b4eeb4,#9bcd9b,#00ffff,#b4eeb4,#9bcd9b,#00ffff,#b4eeb4,#9bcd9b,#00ffff,#b4eeb4" altNodeColorSequence="#87ceff,#ffaeb9,#ffc888,#87ceff,#ffaeb9,#ffc888,#87ceff,#ffaeb9,#ffc888,#87ceff,#ffaeb9,#ffc888,#87ceff,#ffaeb9,#ffc888,#87ceff,#ffaeb9,#ffc888,#87ceff,#ffaeb9,#ffc888,#87ceff,#ffaeb9,#ffc888,#87ceff,#ffaeb9,#ffc888,#87ceff,#ffaeb9" />
	<groupColorInfo name="punctuation" groupColor="#00c800" groupOutlineColor="#dadada" nodeColorSequence="#ff91ff,#729acc,#c8e4f3,#8eacde,#c8e4f3" altNodeColorSequence="#ff91ff,#729acc,#c8e4f3,#8eacde,#c8e4f3" />
	<groupColorInfo name="limitedPunctuation" groupColor="#00c800" groupOutlineColor="#dadada" nodeColorSequence="#dcdcdc,#ffb6ff,#ff91ff,#729acc,#c8e4f3,#8eacde,#c8e4f3" altNodeColorSequence="#dcdcdc,#ffb6ff,#ff91ff,#729acc,#c8e4f3,#8eacde,#c8e4f3" />
	<groupColorInfo name="punctuationLong" groupColor="#00c800" groupOutlineColor="#dadada" nodeColorSequence="#ffacac,#ff8484,#ffc0c0,#ff9a9a,#ffd2d2,#aaaaaa,#787878,#c3c3c3,#919191,#dcdcdc,#aaaaaa,#787878,#c3c3c3,#919191,#ff91ff,#ff52ff,#ffa2ff,#ff80ff,#ffb6ff,#ff91ff,#ff52ff,#ffa2ff,#ff80ff,#ffb6ff,#ff52ff,#ffa2ff,#ff80ff,#ffb6ff,#ff91ff,#f5f5f5,#8eacde,#6e82bc,#aac8e8,#729acc,#c8e4f3,#8eacde,#c8e4f3" altNodeColorSequence="#ffacac,#ff8484,#ffc0c0,#ff9a9a,#ffd2d2,#aaaaaa,#787878,#c3c3c3,#919191,#dcdcdc,#aaaaaa,#787878,#c3c3c3,#919191,#ff91ff,#ff52ff,#ffa2ff,#ff80ff,#ffb6ff,#ff91ff,#ff52ff,#ffa2ff,#ff80ff,#ffb6ff,#ff52ff,#ffa2ff,#ff80ff,#ffb6ff,#ff91ff,#ffffff,#8eacde,#6e82bc,#aac8e8,#729acc,#c8e4f3,#8eacde,#c8e4f3" />
	<groupColorInfo name="numbers" groupColor="#ff0000" groupOutlineColor="#dadada" nodeColorSequence="#ffacac,#ff8484,#ffc0c0,#ff9a9a,#ffd2d2" altNodeColorSequence="#ffacac,#ff8484,#ffc0c0,#ff9a9a,#ffd2d2" />
	<groupColorInfo name="accents" groupColor="#00c800" groupOutlineColor="#dadada" nodeColorSequence="#ffe600,#ffe66e" altNodeColorSequence="#ffe600,#ffe66e" />
	<groupColorInfo name="space" nodeColorSequence="#f5f5f5" />
	<groupColorInfo name="paragraph" nodeColorSequence="#f5f5f5" />
	<groupColorInfo name="paragraphSpace" nodeColorSequence="#f5f5f5,#f5f5f5" />
</colors>