<?xml version="1.0" encoding="UTF-8"?>
<!DOCTYPE colors SYSTEM "color.dtd">
<colors name="Rainbow" parentName="Default" firstStartBoxColor="#ff9a9a" secondStartBoxColor="#ffd2d2" twoPushDynamicInactiveMarkerColor="#ffc888" twoPushDynamicOuterGuidesColor="#fff082">
	<groupColorInfo name="lowercase" nodeColorSequence="#ff7777,#f50000,#ff4545,#f98b00,#ff9c60,#ffc888,#ffe600,#fffa00,#fff082,#e6ffa0,#dfff00,#c8ff50,#00fa00,#00f714,#64ff78,#64ffc8,#00ffb9,#00ffc8,#00d7f0,#8cd7ff,#00cdff,#5a5aff,#0064f5,#8c8cff,#c35aff,#d76eff,#ff77d1,#d700fa,#fa00d1,#ff5ac0" altNodeColorSequence="#ff7777,#f50000,#ff4545,#f98b00,#ff9c60,#ffc888,#ffe600,#fffa00,#fff082,#e6ffa0,#dfff00,#c8ff50,#00fa00,#00f714,#64ff78,#64ffc8,#00ffb9,#00ffc8,#00d7f0,#8cd7ff,#00cdff,#5a5aff,#0064f5,#8c8cff,#c35aff,#d76eff,#ff77d1,#d700fa,#fa00d1,#ff5ac0" />
	<groupColorInfo name="lowercaseBackground" groupColor="#dcdcdc" groupOutlineColor="#dadada" nodeColorSequence="#ff7777,#f50000,#ff4545,#f98b00,#ff9c60,#ffc888,#ffe600,#fffa00,#fff082,#e6ffa0,#dfff00,#c8ff50,#00fa00,#00f714,#64ff78,#64ffc8,#00ffb9,#00ffc8,#00d7f0,#8cd7ff,#00cdff,#5a5aff,#0064f5,#8c8cff,#c35aff,#d76eff,#ff77d1,#d700fa,#fa00d1,#ff5ac0" altNodeColorSequence="#ff7777,#f50000,#ff4545,#f98b00,#ff9c60,#ffc888,#ffe600,#fffa00,#fff082,#e6ffa0,#dfff00,#c8ff50,#00fa00,#00f714,#64ff78,#64ffc8,#00ffb9,#00ffc8,#00d7f0,#8cd7ff,#00cdff,#5a5aff,#0064f5,#8c8cff,#c35aff,#d76eff,#ff77d1,#d700fa,#fa00d1,#ff5ac0" />
	<groupColorInfo name="uppercase" groupColor="#ffff00" groupOutlineColor="#dadada" nodeColorSequence="#ff7777,#f50000,#ff4545,#f98b00,#ff9c60,#ffc888,#ffe600,#fffa00,#fff082,#e6ffa0,#dfff00,#c8ff50,#00fa00,#00f714,#64ff78,#64ffc8,#00ffb9,#00ffc8,#00d7f0,#8cd7ff,#00cdff,#5a5aff,#0064f5,#8c8cff,#c35aff,#d76eff,#ff77d1,#d700fa,#fa00d1" altNodeColorSequence="#ff7777,#f50000,#ff4545,#f98b00,#ff9c60,#ffc888,#ffe600,#fffa00,#fff082,#e6ffa0,#dfff00,#c8ff50,#00fa00,#00f714,#64ff78,#64ffc8,#00ffb9,#00ffc8,#00d7f0,#8cd7ff,#00cdff,#5a5aff,#0064f5,#8c8cff,#c35aff,#d76eff,#ff77d1,#d700fa,#fa00d1" />
	<groupColorInfo name="punctuation" groupColor="#00c800" groupOutlineColor="#dadada" nodeColorSequence="#ff91ff,#729acc,#c8e4f3,#8eacde,#c8e4f3" altNodeColorSequence="#ff91ff,#729acc,#c8e4f3,#8eacde,#c8e4f3" />
	<groupColorInfo name="limitedPunctuation" groupColor="#00c800" groupOutlineColor="#dadada" nodeColorSequence="#dcdcdc,#ffb6ff,#ff91ff,#729acc,#c8e4f3,#8eacde,#c8e4f3" altNodeColorSequence="#dcdcdc,#ffb6ff,#ff91ff,#729acc,#c8e4f3,#8eacde,#c8e4f3" />
	<groupColorInfo name="punctuationLong" groupColor="#00c800" groupOutlineColor="#dadada" nodeColorSequence="#ffacac,#ff8484,#ffc0c0,#ff9a9a,#ffd2d2,#aaaaaa,#787878,#c3c3c3,#919191,#dcdcdc,#aaaaaa,#787878,#c3c3c3,#919191,#ff91ff,#ff52ff,#ffa2ff,#ff80ff,#ffb6ff,#ff91ff,#ff52ff,#ffa2ff,#ff80ff,#ffb6ff,#ff52ff,#ffa2ff,#ff80ff,#ffb6ff,#ff91ff,#ebebeb,#8eacde,#6e82bc,#aac8e8,#729acc,#c8e4f3,#8eacde,#c8e4f3" altNodeColorSequence="#ffacac,#ff8484,#ffc0c0,#ff9a9a,#ffd2d2,#aaaaaa,#787878,#c3c3c3,#919191,#dcdcdc,#aaaaaa,#787878,#c3c3c3,#919191,#ff91ff,#ff52ff,#ffa2ff,#ff80ff,#ffb6ff,#ff91ff,#ff52ff,#ffa2ff,#ff80ff,#ffb6ff,#ff52ff,#ffa2ff,#ff80ff,#ffb6ff,#ff91ff,#ffffff,#8eacde,#6e82bc,#aac8e8,#729acc,#c8e4f3,#8eacde,#c8e4f3" />
	<groupColorInfo name="numbers" groupColor="#ff0000" groupOutlineColor="#dadada" nodeColorSequence="#ffacac,#ff8484,#ffc0c0,#ff9a9a,#ffd2d2" altNodeColorSequence="#ffacac,#ff8484,#ffc0c0,#ff9a9a,#ffd2d2" />
	<groupColorInfo name="accents" groupColor="#00c800" groupOutlineColor="#dadada" nodeColorSequence="#ffe600,#ffe66e" altNodeColorSequence="#ffe600,#ffe66e" />
	<groupColorInfo name="space" nodeColorSequence="#ebebeb" />
	<groupColorInfo name="paragraph" nodeColorSequence="#ebebeb" />
	<groupColorInfo name="paragraphSpace" nodeColorSequence="#ebebeb,#ebebeb" />
</colors>