<?xml version="1.0" encoding="UTF-8"?>
<!DOCTYPE colors SYSTEM "color.dtd">
<colors name="TurboLUT" parentName="Default" defaultOutlineColor="#323232" firstStartBoxColor="#ff9a9a" secondStartBoxColor="#ffd2d2" twoPushDynamicInactiveMarkerColor="#ffc888" twoPushDynamicOuterGuidesColor="#fff082" warningTextColor="#78787880">
	<groupColorInfo name="lowercase" nodeColorSequence="#bc96c6,#a7a3f7,#9aacff,#8eb5ff,#81beff,#71c9ff,#5bd5ff,#44e0ed,#30e9c7,#29eea5,#3ef17e,#62f157,#85ee36,#a1e824,#bde025,#d9d42f,#f1c738,#ffb93c,#ffa83c,#ff963b,#ff853c,#ff793e,#ff7142,#ff6f48,#ff7050,#ff755d,#ff77d1,#d700fa,#fa00d1,#ff5ac0" altNodeColorSequence="#caa4d4,#b5b1ff,#a8bbff,#9cc4ff,#90cdff,#81d8ff,#6de4ff,#59f0fd,#4af9d6,#45feb4,#53ff8c,#72ff65,#94fe46,#b0f936,#ccf036,#e8e43e,#ffd647,#ffc84a,#ffb749,#ffa548,#ff9348,#ff874a,#ff7f4e,#ff7d53,#ff7e5b,#ff8269,#ff77d1,#d700fa,#fa00d1,#ff5ac0" />
	<groupColorInfo name="lowercaseBackground" groupColor="#dcdcdc80" groupOutlineColor="#323232" nodeColorSequence="#bc96c6,#a7a3f7,#9aacff,#8eb5ff,#81beff,#71c9ff,#5bd5ff,#44e0ed,#30e9c7,#29eea5,#3ef17e,#62f157,#85ee36,#a1e824,#bde025,#d9d42f,#f1c738,#ffb93c,#ffa83c,#ff963b,#ff853c,#ff793e,#ff7142,#ff6f48,#ff7050,#ff755d,#ff77d1,#d700fa,#fa00d1,#ff5ac0" altNodeColorSequence="#caa4d4,#b5b1ff,#a8bbff,#9cc4ff,#90cdff,#81d8ff,#6de4ff,#59f0fd,#4af9d6,#45feb4,#53ff8c,#72ff65,#94fe46,#b0f936,#ccf036,#e8e43e,#ffd647,#ffc84a,#ffb749,#ffa548,#ff9348,#ff874a,#ff7f4e,#ff7d53,#ff7e5b,#ff8269,#ff77d1,#d700fa,#fa00d1,#ff5ac0" />
	<groupColorInfo name="uppercase" groupColor="#78787880" groupOutlineColor="#323232" nodeColorSequence="#bc96c6,#a7a3f7,#9aacff,#8eb5ff,#81beff,#71c9ff,#5bd5ff,#44e0ed,#30e9c7,#29eea5,#3ef17e,#62f157,#85ee36,#a1e824,#bde025,#d9d42f,#f1c738,#ffb93c,#ffa83c,#ff963b,#ff853c,#ff793e,#ff7142,#ff6f48,#ff7050,#ff755d,#ff77d1,#d700fa,#fa00d1" altNodeColorSequence="#caa4d4,#b5b1ff,#a8bbff,#9cc4ff,#90cdff,#81d8ff,#6de4ff,#59f0fd,#4af9d6,#45feb4,#53ff8c,#72ff65,#94fe46,#b0f936,#ccf036,#e8e43e,#ffd647,#ffc84a,#ffb749,#ffa548,#ff9348,#ff874a,#ff7f4e,#ff7d53,#ff7e5b,#ff8269,#ff77d1,#d700fa,#fa00d1" />
	<groupColorInfo name="punctuation" groupColor="#00c800" groupOutlineColor="#323232" nodeColorSequence="#ff91ff,#729acc,#c8e4f3,#8eacde,#c8e4f3" altNodeColorSequence="#ff91ff,#729acc,#c8e4f3,#8eacde,#c8e4f3" />
	<groupColorInfo name="limitedPunctuation" groupColor="#00c800" groupOutlineColor="#323232" nodeColorSequence="#dcdcdc80,#ffb6ff,#ff91ff,#729acc,#c8e4f3,#8eacde,#c8e4f3" altNodeColorSequence="#dcdcdc,#ffb6ff,#ff91ff,#729acc,#c8e4f3,#8eacde,#c8e4f3" />
	<groupColorInfo name="punctuationLong" groupColor="#00c800" groupOutlineColor="#323232" nodeColorSequence="#ffacac,#ff8484,#ffc0c0,#ff9a9a,#ffd2d2,#aaaaaa,#78787880,#c3c3c3,#919191,#dcdcdc80,#aaaaaa,#78787880,#c3c3c3,#919191,#ff91ff,#ff52ff,#ffa2ff,#ff80ff,#ffb6ff,#ff91ff,#ff52ff,#ffa2ff,#ff80ff,#ffb6ff,#ff52ff,#ffa2ff,#ff80ff,#ffb6ff,#ff91ff,#ebebeb,#8eacde,#6e82bc,#aac8e8,#729acc,#c8e4f3,#8eacde,#c8e4f3" altNodeColorSequence="#ffacac,#ff8484,#ffc0c0,#ff9a9a,#ffd2d2,#aaaaaa,#787878,#c3c3c3,#919191,#dcdcdc,#aaaaaa,#787878,#c3c3c3,#919191,#ff91ff,#ff52ff,#ffa2ff,#ff80ff,#ffb6ff,#ff91ff,#ff52ff,#ffa2ff,#ff80ff,#ffb6ff,#ff52ff,#ffa2ff,#ff80ff,#ffb6ff,#ff91ff,#ffffff,#8eacde,#6e82bc,#aac8e8,#729acc,#c8e4f3,#8eacde,#c8e4f3" />
	<groupColorInfo name="numbers" groupColor="#ff0000" groupOutlineColor="#323232" nodeColorSequence="#ffacac,#ff8484,#ffc0c0,#ff9a9a,#ffd2d2" altNodeColorSequence="#ffacac,#ff8484,#ffc0c0,#ff9a9a,#ffd2d2" />
	<groupColorInfo name="accents" groupColor="#00c800" groupOutlineColor="#323232" nodeColorSequence="#ffe600,#ffe66e" altNodeColorSequence="#ffe600,#ffe66e" />
	<groupColorInfo name="space" nodeColorSequence="#ebebeb" />
	<groupColorInfo name="paragraph" nodeColorSequence="#ebebeb" />
	<groupColorInfo name="paragraphSpace" nodeColorSequence="#ebebeb,#ebebeb" />
</colors>