<?xml version="1.0" encoding="UTF-8"?>
<!DOCTYPE colors SYSTEM "color.dtd">
<colors name="Yellow on Blue" parentName="Default" backgroundColor="#000032" rootNodeColor="#088ab4" defaultOutlineColor="#afb9da" defaultLabelColor="#ffff37" firstStartBoxColor="#ff9a9a" secondStartBoxColor="#ffd2d2" twoPushDynamicInactiveMarkerColor="#ffc888" twoPushDynamicOuterGuidesColor="#fff082" infoTextColor="#000032" conversionNodeColor="#000023">
	<groupColorInfo name="lowercase" nodeColorSequence="#3226aa,#463796,#003764,#3226a0,#463296,#3226aa,#463796,#003764,#3226a0,#463296,#3226aa,#463796,#003764,#3226a0,#463296,#3226aa,#463796,#003764,#3226a0,#463296,#3226aa,#463796,#003764,#3226a0,#463296,#3226aa,#463796,#003764,#3226a0,#463296" altNodeColorSequence="#3c26b4,#5037a0,#08376c,#3c26aa,#5032a0,#3c26b4,#5037a0,#08376c,#3c26aa,#5032a0,#3c26b4,#5037a0,#08376c,#3c26aa,#5032a0,#3c26b4,#5037a0,#08376c,#3c26aa,#5032a0,#3c26b4,#5037a0,#08376c,#3c26aa,#5032a0,#3c26b4,#5037a0,#08376c,#3c26aa,#5032a0" />
	<groupColorInfo name="lowercaseBackground" groupColor="#dcdcdc" groupOutlineColor="#afb9da" nodeColorSequence="#3226aa,#463796,#003764,#3226a0,#463296,#3226aa,#463796,#003764,#3226a0,#463296,#3226aa,#463796,#003764,#3226a0,#463296,#3226aa,#463796,#003764,#3226a0,#463296,#3226aa,#463796,#003764,#3226a0,#463296,#3226aa,#463796,#003764,#3226a0,#463296" altNodeColorSequence="#3c26b4,#5037a0,#08376c,#3c26aa,#5032a0,#3c26b4,#5037a0,#08376c,#3c26aa,#5032a0,#3c26b4,#5037a0,#08376c,#3c26aa,#5032a0,#3c26b4,#5037a0,#08376c,#3c26aa,#5032a0,#3c26b4,#5037a0,#08376c,#3c26aa,#5032a0,#3c26b4,#5037a0,#08376c,#3c26aa,#5032a0" />
	<groupColorInfo name="uppercase" groupColor="#ffff00" groupOutlineColor="#afb9da" nodeColorSequence="#3226aa,#463796,#003764,#3226a0,#463296,#3226aa,#463796,#003764,#3226a0,#463296,#3226aa,#463796,#003764,#3226a0,#463296,#3226aa,#463796,#003764,#3226a0,#463296,#3226aa,#463796,#003764,#3226a0,#463296,#3226aa,#463796,#003764,#3226a0" altNodeColorSequence="#3c26b4,#5037a0,#08376c,#3c26aa,#5032a0,#3c26b4,#5037a0,#08376c,#3c26aa,#5032a0,#3c26b4,#5037a0,#08376c,#3c26aa,#5032a0,#3c26b4,#5037a0,#08376c,#3c26aa,#5032a0,#3c26b4,#5037a0,#08376c,#3c26aa,#5032a0,#3c26b4,#5037a0,#08376c,#3c26aa" />
	<groupColorInfo name="punctuation" groupColor="#00c800" groupOutlineColor="#afb9da" nodeColorSequence="#ff91ff,#729acc,#c8e4f3,#8eacde,#c8e4f3" altNodeColorSequence="#ff91ff,#729acc,#c8e4f3,#8eacde,#c8e4f3" />
	<groupColorInfo name="limitedPunctuation" groupColor="#00c800" groupOutlineColor="#afb9da" nodeColorSequence="#dcdcdc,#ffb6ff,#ff91ff,#729acc,#c8e4f3,#8eacde,#c8e4f3" altNodeColorSequence="#dcdcdc,#ffb6ff,#ff91ff,#729acc,#c8e4f3,#8eacde,#c8e4f3" />
	<groupColorInfo name="punctuationLong" groupColor="#00c800" groupOutlineColor="#afb9da" nodeColorSequence="#ffacac,#ff8484,#ffc0c0,#ff9a9a,#ffd2d2,#aaaaaa,#787878,#c3c3c3,#919191,#dcdcdc,#aaaaaa,#787878,#c3c3c3,#919191,#ff91ff,#ff52ff,#ffa2ff,#ff80ff,#ffb6ff,#ff91ff,#ff52ff,#ffa2ff,#ff80ff,#ffb6ff,#ff52ff,#ffa2ff,#ff80ff,#ffb6ff,#ff91ff,#000023,#8eacde,#6e82bc,#aac8e8,#729acc,#c8e4f3,#8eacde,#c8e4f3" altNodeColorSequence="#ffacac,#ff8484,#ffc0c0,#ff9a9a,#ffd2d2,#aaaaaa,#787878,#c3c3c3,#919191,#dcdcdc,#aaaaaa,#787878,#c3c3c3,#919191,#ff91ff,#ff52ff,#ffa2ff,#ff80ff,#ffb6ff,#ff91ff,#ff52ff,#ffa2ff,#ff80ff,#ffb6ff,#ff52ff,#ffa2ff,#ff80ff,#ffb6ff,#ff91ff,#000005,#8eacde,#6e82bc,#aac8e8,#729acc,#c8e4f3,#8eacde,#c8e4f3" />
	<groupColorInfo name="numbers" groupColor="#ff0000" groupOutlineColor="#afb9da" nodeColorSequence="#ffacac,#ff8484,#ffc0c0,#ff9a9a,#ffd2d2" altNodeColorSequence="#ffacac,#ff8484,#ffc0c0,#ff9a9a,#ffd2d2" />
	<groupColorInfo name="accents" groupColor="#00c800" groupOutlineColor="#afb9da" nodeColorSequence="#ffe600,#ffe66e" altNodeColorSequence="#ffe600,#ffe66e" />
	<groupColorInfo name="space" nodeColorSequence="#000023" />
	<groupColorInfo name="paragraph" nodeColorSequence="#000023" />
	<groupColorInfo name="paragraphSpace" nodeColorSequence="#000023,#000023" />
</colors>