<?xml version="1.0" encoding="UTF-8"?>
<!DOCTYPE colors SYSTEM "color.dtd">
<colors name="Default" backgroundColor="#ffffff" inputLineColor="#ff0000" inputPositionColor="#000000" crosshairColor="#000000" rootNodeColor="#b4eeb4" defaultOutlineColor="#dadada" defaultLabelColor="#000000" selectionHighlightColor="#ff0000" selectionInactiveColor="#000000" circleOutlineColor="#000000" circleStoppedColor="#ff0000" circleWaitingColor="#f0f000" circleStartedColor="#00ff00" firstStartBoxColor="#ff0000" secondStartBoxColor="#ffff00" twoPushDynamicActiveMarkerColor="#00ff00" twoPushDynamicInactiveMarkerColor="#00ffff" oneButtonDynamicOuterGuidesColor="#000000" twoPushDynamicOuterGuidesColor="#b4eeb4" infoTextColor="#ffffff" infoTextBackgroundColor="#000000" warningTextColor="#ffff00" warningTextBackgroundColor="#000000" gameGuideColor="#ff64cc" conversionNodeColor="#ebebeb">
	<groupColorInfo name="lowercase" nodeColorSequence="#00ffff,#b4eeb4,#9bcd9b,#00ffff,#b4eeb4,#9bcd9b,#00ffff,#b4eeb4,#9bcd9b,#00ffff,#b4eeb4,#9bcd9b,#00ffff,#b4eeb4,#9bcd9b,#00ffff,#b4eeb4,#9bcd9b,#00ffff,#b4eeb4,#9bcd9b,#00ffff,#b4eeb4,#9bcd9b,#00ffff,#b4eeb4,#9bcd9b,#00ffff,#b4eeb4,#9bcd9b" altNodeColorSequence="#87ceff,#ffaeb9,#ffbbff,#87ceff,#ffaeb9,#ffbbff,#87ceff,#ffaeb9,#ffbbff,#87ceff,#ffaeb9,#ffbbff,#87ceff,#ffaeb9,#ffbbff,#87ceff,#ffaeb9,#ffbbff,#87ceff,#ffaeb9,#ffbbff,#87ceff,#ffaeb9,#ffbbff,#87ceff,#ffaeb9,#ffbbff,#87ceff,#ffaeb9,#ffbbff" />
	<groupColorInfo name="lowercaseBackground" groupColor="#9bcd9b" groupOutlineColor="#dadada" nodeColorSequence="#00ffff,#b4eeb4,#9bcd9b,#00ffff,#b4eeb4,#9bcd9b,#00ffff,#b4eeb4,#9bcd9b,#00ffff,#b4eeb4,#9bcd9b,#00ffff,#b4eeb4,#9bcd9b,#00ffff,#b4eeb4,#9bcd9b,#00ffff,#b4eeb4,#9bcd9b,#00ffff,#b4eeb4,#9bcd9b,#00ffff,#b4eeb4,#9bcd9b,#00ffff,#b4eeb4,#9bcd9b" altNodeColorSequence="#87ceff,#ffaeb9,#ffbbff,#87ceff,#ffaeb9,#ffbbff,#87ceff,#ffaeb9,#ffbbff,#87ceff,#ffaeb9,#ffbbff,#87ceff,#ffaeb9,#ffbbff,#87ceff,#ffaeb9,#ffbbff,#87ceff,#ffaeb9,#ffbbff,#87ceff,#ffaeb9,#ffbbff,#87ceff,#ffaeb9,#ffbbff,#87ceff,#ffaeb9,#ffbbff" />
	<groupColorInfo name="uppercase" groupColor="#ffff00" groupOutlineColor="#dadada" nodeColorSequence="#00ffff,#b4eeb4,#9bcd9b,#00ffff,#b4eeb4,#9bcd9b,#00ffff,#b4eeb4,#9bcd9b,#00ffff,#b4eeb4,#9bcd9b,#00ffff,#b4eeb4,#9bcd9b,#00ffff,#b4eeb4,#9bcd9b,#00ffff,#b4eeb4,#9bcd9b,#00ffff,#b4eeb4,#9bcd9b,#00ffff,#b4eeb4,#9bcd9b,#00ffff,#b4eeb4" altNodeColorSequence="#87ceff,#ffaeb9,#ffbbff,#87ceff,#ffaeb9,#ffbbff,#87ceff,#ffaeb9,#ffbbff,#87ceff,#ffaeb9,#ffbbff,#87ceff,#ffaeb9,#ffbbff,#87ceff,#ffaeb9,#ffbbff,#87ceff,#ffaeb9,#ffbbff,#87ceff,#ffaeb9,#ffbbff,#87ceff,#ffaeb9,#ffbbff,#87ceff,#ffaeb9" />
	<groupColorInfo name="punctuation" groupColor="#00c800" groupOutlineColor="#dadada" nodeColorSequence="#9bcd9b,#00ffff,#b4eeb4,#00ffff,#b4eeb4" altNodeColorSequence="#ffbbff,#87ceff,#ffaeb9,#87ceff,#ffaeb9" />
	<groupColorInfo name="limitedPunctuation" groupColor="#00c800" groupOutlineColor="#dadada" nodeColorSequence="#9bcd9b,#00ffff,#9bcd9b,#00ffff,#b4eeb4,#00ffff,#b4eeb4" altNodeColorSequence="#ffbbff,#87ceff,#ffbbff,#87ceff,#ffaeb9,#87ceff,#ffaeb9" />
	<groupColorInfo name="punctuationLong" groupColor="#00c800" groupOutlineColor="#dadada" nodeColorSequence="#9bcd9b,#00ffff,#b4eeb4,#9bcd9b,#00ffff,#b4eeb4,#9bcd9b,#00ffff,#b4eeb4,#9bcd9b,#b4eeb4,#9bcd9b,#00ffff,#b4eeb4,#9bcd9b,#00ffff,#b4eeb4,#9bcd9b,#00ffff,#9bcd9b,#00ffff,#b4eeb4,#9bcd9b,#00ffff,#00ffff,#b4eeb4,#9bcd9b,#00ffff,#9bcd9b,#ebebeb,#00ffff,#b4eeb4,#9bcd9b,#00ffff,#b4eeb4,#00ffff,#b4eeb4" altNodeColorSequence="#ffbbff,#87ceff,#ffaeb9,#ffbbff,#87ceff,#ffaeb9,#ffbbff,#87ceff,#ffaeb9,#ffbbff,#ffaeb9,#ffbbff,#87ceff,#ffaeb9,#ffbbff,#87ceff,#ffaeb9,#ffbbff,#87ceff,#ffbbff,#87ceff,#ffaeb9,#ffbbff,#87ceff,#87ceff,#ffaeb9,#ffbbff,#87ceff,#ffbbff,#ffffff,#87ceff,#ffaeb9,#ffbbff,#87ceff,#ffaeb9,#87ceff,#ffaeb9" />
	<groupColorInfo name="numbers" groupColor="#ff0000" groupOutlineColor="#dadada" nodeColorSequence="#9bcd9b,#00ffff,#b4eeb4,#9bcd9b,#00ffff" altNodeColorSequence="#ffbbff,#87ceff,#ffaeb9,#ffbbff,#87ceff" />
	<groupColorInfo name="accents" groupColor="#00c800" groupOutlineColor="#dadada" nodeColorSequence="#9bcd9b,#00ffff" altNodeColorSequence="#ffbbff,#87ceff" />
	<groupColorInfo name="space" nodeColorSequence="#ebebeb" />
	<groupColorInfo name="paragraph" nodeColorSequence="#ebebeb" />
	<groupColorInfo name="paragraphSpace" nodeColorSequence="#ebebeb,#ebebeb" />
</colors>