<?xml version="1.0" encoding="UTF-8"?>
<!DOCTYPE colors SYSTEM "color.dtd">
<colors name="Yellow on Black" parentName="Default" backgroundColor="#181712" inputLineColor="#3f3d38" inputPositionColor="#ffffff" rootNodeColor="#181712" defaultOutlineColor="#636363" defaultLabelColor="#ffff00" selectionHighlightColor="#3f3d38" selectionInactiveColor="#ffffff" circleOutlineColor="#ffffff" circleStoppedColor="#181712" firstStartBoxColor="#181712" secondStartBoxColor="#181712" twoPushDynamicInactiveMarkerColor="#181712" oneButtonDynamicOuterGuidesColor="#ffffff" twoPushDynamicOuterGuidesColor="#181712" infoTextColor="#181712" warningTextColor="#181712" conversionNodeColor="#000000">
	<groupColorInfo name="lowercase" nodeColorSequence="#181712,#181712,#181712,#181712,#181712,#181712,#181712,#181712,#181712,#181712,#181712,#181712,#181712,#181712,#181712,#181712,#181712,#181712,#181712,#181712,#181712,#181712,#181712,#181712,#181712,#181712,#181712,#181712,#181712,#181712" altNodeColorSequence="#181712,#181712,#181712,#181712,#181712,#181712,#181712,#181712,#181712,#181712,#181712,#181712,#181712,#181712,#181712,#181712,#181712,#181712,#181712,#181712,#181712,#181712,#181712,#181712,#181712,#181712,#181712,#181712,#181712,#181712" />
	<groupColorInfo name="lowercaseBackground" groupColor="#181712" groupOutlineColor="#636363" nodeColorSequence="#181712,#181712,#181712,#181712,#181712,#181712,#181712,#181712,#181712,#181712,#181712,#181712,#181712,#181712,#181712,#181712,#181712,#181712,#181712,#181712,#181712,#181712,#181712,#181712,#181712,#181712,#181712,#181712,#181712,#181712" altNodeColorSequence="#181712,#181712,#181712,#181712,#181712,#181712,#181712,#181712,#181712,#181712,#181712,#181712,#181712,#181712,#181712,#181712,#181712,#181712,#181712,#181712,#181712,#181712,#181712,#181712,#181712,#181712,#181712,#181712,#181712,#181712" />
	<groupColorInfo name="uppercase" groupColor="#181712" groupOutlineColor="#636363" nodeColorSequence="#181712,#181712,#181712,#181712,#181712,#181712,#181712,#181712,#181712,#181712,#181712,#181712,#181712,#181712,#181712,#181712,#181712,#181712,#181712,#181712,#181712,#181712,#181712,#181712,#181712,#181712,#181712,#181712,#181712" altNodeColorSequence="#181712,#181712,#181712,#181712,#181712,#181712,#181712,#181712,#181712,#181712,#181712,#181712,#181712,#181712,#181712,#181712,#181712,#181712,#181712,#181712,#181712,#181712,#181712,#181712,#181712,#181712,#181712,#181712,#181712" />
	<groupColorInfo name="punctuation" groupColor="#181712" groupOutlineColor="#636363" nodeColorSequence="#181712,#181712,#181712,#181712,#181712" altNodeColorSequence="#181712,#181712,#181712,#181712,#181712" />
	<groupColorInfo name="limitedPunctuation" groupColor="#181712" groupOutlineColor="#636363" nodeColorSequence="#181712,#181712,#181712,#181712,#181712,#181712,#181712" altNodeColorSequence="#181712,#181712,#181712,#181712,#181712,#181712,#181712" />
	<groupColorInfo name="punctuationLong" groupColor="#181712" groupOutlineColor="#636363" nodeColorSequence="#181712,#181712,#181712,#181712,#181712,#181712,#181712,#181712,#181712,#181712,#181712,#181712,#181712,#181712,#181712,#181712,#181712,#181712,#181712,#181712,#181712,#181712,#181712,#181712,#181712,#181712,#181712,#181712,#181712,#000000,#181712,#181712,#181712,#181712,#181712,#181712,#181712" altNodeColorSequence="#181712,#181712,#181712,#181712,#181712,#181712,#181712,#181712,#181712,#181712,#181712,#181712,#181712,#181712,#181712,#181712,#181712,#181712,#181712,#181712,#181712,#181712,#181712,#181712,#181712,#181712,#181712,#181712,#181712,#000000,#181712,#181712,#181712,#181712,#181712,#181712,#181712" />
	<groupColorInfo name="numbers" groupColor="#181712" groupOutlineColor="#636363" nodeColorSequence="#181712,#181712,#181712,#181712,#181712" altNodeColorSequence="#181712,#181712,#181712,#181712,#181712" />
	<groupColorInfo name="accents" groupColor="#181712" groupOutlineColor="#636363" nodeColorSequence="#181712,#181712" altNodeColorSequence="#181712,#181712" />
	<groupColorInfo name="space" nodeColorSequence="#000000" />
	<groupColorInfo name="paragraph" nodeColorSequence="#000000" />
	<groupColorInfo name="paragraphSpace" nodeColorSequence="#000000,#000000" />
</colors>